{
  "protocol": "ghostroom/0",
  "id": "evt-review-0001",
  "timestamp": "2026-09-27T02:30:00.000Z",
  "origin": {
    "kind": "agent",
    "id": "codex",
    "provider": "codex",
    "display_name": "Codex"
  },
  "lane": "codex",
  "kind": "review",
  "parent": "evt-exec-0001",
  "status": "started",
  "body": {
    "subject": {
      "type": "event",
      "event_id": "evt-exec-0001"
    },
    "verdict": "requested",
    "role": "reviewer",
    "reviewer": "claude"
  }
}
